{
  "activation": {
    "approved_at": "2026-07-12T00:00:00Z",
    "approved_by": "synthetic-fixture-author"
  },
  "bundle_schema_version": 2,
  "lineage": {
    "opf_content_hash": "sha256:56f690d109917a453d90944173e5a3322c3b8b70f66d5b17da11027b52b2269e",
    "opf_section_digests": {
      "evidence": "sha256:26efd24db9fcdbfbea7e36340ad3ebe647201dd8a68c545bd97b24d7b6406355",
      "floor": "sha256:f28611fa5ed41baccfcc5a9d2e1a33198ffe681698a12024621db5a87d21a1bd",
      "posture": "sha256:aef5e5d34149d1cea93e7c981d15c534e6962d6eea30b683263161ef67a23842"
    }
  },
  "model_policy": {
    "hash": "sha256:81e512a8835ee5c6068067e5fb3a621eac68045049058130ce75a43b548f3981",
    "path": "model-policy/openrouter.json"
  },
  "opf": {
    "agreement_type": {
      "aliases": [
        "eiaa",
        "synthetic-generic"
      ],
      "description": "Synthetic fixture for issue #283 -- freshly authored, not copied from any engine example.",
      "id": "educational-internship-affiliation",
      "name": "Synthetic Educational Internship & Affiliation Agreement"
    },
    "baseline": {
      "has_canonical_template": false
    },
    "compiler": {
      "generated_at": "2026-07-12T00:00:00Z",
      "name": "synthetic-fixture-author",
      "version": "0.0.1"
    },
    "corpus": {
      "documents": [
        {
          "document_id": "synthetic-doc-001",
          "in_scope": true,
          "provenance": "our_paper",
          "signed_on": "2025-05",
          "signed_on_basis": "signature_block",
          "signed_version": 1,
          "title": "Synthetic Fixture Document 1",
          "versions": 1
        },
        {
          "document_id": "synthetic-doc-002",
          "in_scope": true,
          "provenance": "counterparty_paper",
          "signed_on": null,
          "signed_on_basis": null,
          "signed_version": 1,
          "title": "Synthetic Fixture Document 2",
          "versions": 1
        }
      ],
      "stats": {
        "document_count": 2
      }
    },
    "evidence": {
      "absence": {
        "guard": 0.1,
        "records": [
          {
            "basis": "scored",
            "candidates": [
              {
                "filed_under": "liability_cap",
                "ref": {
                  "char_span": [
                    0,
                    87
                  ],
                  "clause_path": "5.2",
                  "document_id": "synthetic-doc-001",
                  "version": 1
                },
                "score": 0.143
              }
            ],
            "document_id": "synthetic-doc-001",
            "id": "abs.d280df15b8d07c5f",
            "n_checked": 1,
            "status": "possibly_present",
            "taxonomy_id": "termination"
          },
          {
            "basis": "scored",
            "candidates": [
              {
                "filed_under": "termination",
                "ref": {
                  "char_span": [
                    0,
                    89
                  ],
                  "clause_path": "9.1",
                  "document_id": "synthetic-doc-002",
                  "version": 1
                },
                "score": 0.143
              }
            ],
            "document_id": "synthetic-doc-002",
            "id": "abs.18488c69e70b7ece",
            "n_checked": 1,
            "status": "possibly_present",
            "taxonomy_id": "liability_cap"
          }
        ]
      },
      "clauses": [
        {
          "id": "clause-liability-cap",
          "n_changed_openings": 0,
          "n_deals": 1,
          "n_kept_prior": 0,
          "n_kept_standard": 0,
          "n_moved_to_current": 0,
          "n_opened_prior": 0,
          "n_opened_standard": 0,
          "n_refused": 0,
          "n_signed_standard": 0,
          "n_variants": 1,
          "our_standard": null,
          "prior_standards": [],
          "taxonomy_id": "liability_cap",
          "title": "Liability Cap",
          "why_changed": null
        },
        {
          "id": "clause-termination",
          "n_changed_openings": 0,
          "n_deals": 1,
          "n_kept_prior": 0,
          "n_kept_standard": 0,
          "n_moved_to_current": 0,
          "n_opened_prior": 0,
          "n_opened_standard": 0,
          "n_refused": 0,
          "n_signed_standard": 0,
          "n_variants": 1,
          "our_standard": null,
          "prior_standards": [],
          "taxonomy_id": "termination",
          "title": "Termination for Convenience",
          "why_changed": null
        }
      ],
      "precedent": [
        {
          "document_id": "synthetic-doc-001",
          "id": "prec.00d660b05b9a9a0c",
          "moved": false,
          "opened_with": "non_standard",
          "opening_text": null,
          "paper": "ours",
          "paper_basis": "provenance_detection",
          "paper_confidence": 0.9,
          "refused_asks": [],
          "rounds": 0,
          "signed": true,
          "signed_on": "2025-05",
          "signed_text": {
            "ref": {
              "char_span": [
                0,
                87
              ],
              "clause_path": "5.2",
              "document_id": "synthetic-doc-001",
              "version": 1
            },
            "text": "Synthetic clause: liability is capped at a fixed dollar amount stated in the agreement.",
            "vs_standard": null
          },
          "standard": false,
          "taxonomy_id": "liability_cap"
        },
        {
          "document_id": "synthetic-doc-002",
          "id": "prec.8486b2b2d3deb3f7",
          "moved": false,
          "opened_with": "non_standard",
          "opening_text": null,
          "paper": "theirs",
          "paper_basis": "provenance_detection",
          "paper_confidence": 0.9,
          "refused_asks": [],
          "rounds": 0,
          "signed": true,
          "signed_on": null,
          "signed_text": {
            "ref": {
              "char_span": [
                0,
                89
              ],
              "clause_path": "9.1",
              "document_id": "synthetic-doc-002",
              "version": 1
            },
            "text": "Synthetic clause: either party may terminate for convenience on thirty (30) days' notice.",
            "vs_standard": null
          },
          "standard": false,
          "taxonomy_id": "termination"
        }
      ]
    },
    "floor": {
      "invariants": [
        {
          "id": "floor-no-uncapped-liability",
          "rationale": "Synthetic placeholder rationale for demonstrating Floor invariant structure; not legal advice.",
          "statement": "Our maximum liability under this agreement is a fixed dollar cap stated in the agreement; it is never unlimited or tied solely to a multiplier of fees paid."
        },
        {
          "id": "floor-termination-notice",
          "rationale": "Synthetic placeholder rationale for demonstrating Floor invariant structure; not legal advice.",
          "statement": "Either party may terminate for convenience only with at least 30 days written notice."
        }
      ]
    },
    "identity": {
      "content_hash": "sha256:56f690d109917a453d90944173e5a3322c3b8b70f66d5b17da11027b52b2269e",
      "section_digests": {
        "evidence": "sha256:26efd24db9fcdbfbea7e36340ad3ebe647201dd8a68c545bd97b24d7b6406355",
        "floor": "sha256:f28611fa5ed41baccfcc5a9d2e1a33198ffe681698a12024621db5a87d21a1bd",
        "posture": "sha256:aef5e5d34149d1cea93e7c981d15c534e6962d6eea30b683263161ef67a23842"
      }
    },
    "opf_version": "0.6",
    "posture": {
      "system_prompt": "This is a synthetic posture for a fictional educational internship and affiliation agreement, authored only for test fixtures. It expresses no real party's negotiation intent. Treat all monetary and party details in this document as placeholders."
    },
    "taxonomy": {
      "entries": [
        {
          "id": "liability_cap",
          "label": "Liability Cap",
          "status": "active"
        },
        {
          "id": "termination",
          "label": "Termination for Convenience",
          "status": "active"
        }
      ],
      "source": "synthetic-fixture"
    }
  },
  "output_contract_version": "output-schema-v1",
  "playbook_id": "eiaa",
  "profile": "knowledge"
}
